{
  "$schema": "https://json-schema.org/draft/2020-12/schema",
  "$id": "https://horror-tube.local/schemas/character.schema.json",
  "title": "Character sheet",
  "description": "One character for roster import. Every key listed is required; empty string is allowed only where noted. Do not include strength, intelligence, luck, or role.",
  "type": "object",
  "additionalProperties": false,
  "required": ["label", "look", "brief", "injuries", "status", "icon"],
  "properties": {
    "label": {
      "type": "string",
      "minLength": 1,
      "pattern": "^[a-z0-9]+(?:-[a-z0-9]+)*$",
      "description": "Single lowercase DNS label for the subname under ENS_LABEL."
    },
    "look": {
      "type": "string",
      "minLength": 1,
      "description": "Visible body, costume, silhouette. One sentence."
    },
    "brief": {
      "type": "string",
      "minLength": 1,
      "description": "One short lore line the fight can act on."
    },
    "injuries": {
      "type": "string",
      "description": "Carried damage text. Must be present; use \"\" when unhurt. Missing key is an error."
    },
    "status": {
      "type": "string",
      "enum": ["", "dead"],
      "description": "Must be present. Allowed values: \"\" (selectable) or \"dead\"."
    },
    "icon": {
      "type": "string",
      "description": "HTTPS CDN URL, or \"\" when unset. Missing key is an error."
    }
  }
}
