[
  {
    "label": "fixture-one",
    "look": "Tall figure in a plain dark coat with a blank porcelain mask.",
    "brief": "Silent stalker who closes distance without speaking.",
    "injuries": "",
    "status": "",
    "icon": ""
  },
  {
    "label": "fixture-two",
    "look": "Short fighter in a torn gray hoodie with one glowing red eye lens.",
    "brief": "Charges first and ignores pain until the fight ends.",
    "injuries": "",
    "status": "",
    "icon": "https://cdn.example.test/fixtures/fixture-two.png"
  }
]
